uri,title,event_date,sentiment,categories,loc_country,loc_continent,article_count,total_article_count,summary,nytimes,indiatimes,washingtonpost,usatoday,chinadaily
eng-4516819,'Not sufficient': UN on Saudi trial into Jamal Khashoggi killing,2019-01-01,-0.3568627450980392,"dmoz/Society/Issues, news/Politics, dmoz/Society/Crime/Murder, dmoz/Society/Issues/Crime and Justice",Saudi Arabia,Asia,61,61,"Spokeswoman Ravina Shamdasani, asked on Friday about reports that a Saudi prosecutor had sought death sentence for five suspects linked to the October 2 killing, reiterated the UN office's call for an independent investigation ""with international involvement"".  The UN rights office always opposed the death penalty, she added.  The comments from the UN official came a day after the high-profile trial of the 11 suspects charged with Khashoggi's murder opened in Saudi capital, Riyadh, on Thursday.  ",1,0,0,0,0
eng-4516351,Opinion | American Jews and Israeli Jews Are Headed for a Messy Breakup,2019-01-01,-0.02745098039215688,"news/Politics, dmoz/Society/Politics/Nationalism, dmoz/Society/Religion and Spirituality/Judaism",Israel,Asia,51,51,"Mr. Weisman is the deputy Washington editor of The New York Times.  The events of past year brought American and Israeli Jews ever closer to a breaking point. President Trump, beloved in Israel and decidedly unloved by a majority of American Jews, moved the United States Embassy from Tel Aviv to Jerusalem in May, with the fiery evangelical pastors John Hagee and Robert Jeffress consecrating the ceremony.  In October, after the murder of 11 Jews at the Tree of Life synagogue in Pittsburgh, Preside",1,0,0,0,0
eng-4516041,Egypt's President El-Sisi denies holding political prisoners,2019-01-01,-0.1215686274509804,"dmoz/Society/Issues, news/Politics, dmoz/Society/Politics, dmoz/Society/Issues/Warfare and Conflict",Egypt,Africa,43,43,"Egyptian President Abdel Fattah el-Sisi sat down with Scott Pelley to make news on 60 Minutes and did when he confirmed his military was working with Israel against terrorists in North Sinai. But other questions, including jailing his opponents to maintain his regime and the massacre of 800 civilians by Egypt when he was Defense Minister were not the kind of news his government wanted broadcast. The 60 Minutes team was contacted by the Egyptian Ambassador shortly after and told the interview coul",1,0,0,0,0
eng-4515886,Fratricide in Full Bloom as Israeli Election Campaign Heats Up,2019-01-01,0.1529411764705881,"news/Politics, dmoz/Recreation/Parties/Planning, dmoz/Home/Entertaining/Party Planning, dmoz/Shopping/Entertainment/Party Supplies",Israel,Asia,20,20,"JERUSALEM -- With elections a few months away, it is political fratricide season in Israel: From left to right, candidates are sticking knives in the ribs of their natural allies in hopes of elevating their own chances of succeeding Prime Minister Benjamin Netanyahu.  This week, the Zionist Union, a four-year-old liberal alliance, blew itself up as the Labor Party chief, Avi Gabbay, humiliated the veteran politician Tzipi Livni by abruptly breaking with her and her boutique party Hatnuah (The Mov",1,0,0,0,0
eng-4514473,Opinion | China's Gulag for Muslims ,2019-01-01,-0.1294117647058823,"dmoz/Society/Issues, news/Politics, dmoz/Society/Religion and Spirituality/Islam",China,Asia,16,16,"In modern-day ""re-education"" prisons, Beijing is forcing ethnic Uighurs to forsake their religion. Why don't Muslim governments rise up in anger?  One of the darkest episodes of the 20th century was the gulag -- the Soviet system of forced labor camps where dissidents were imprisoned in terrible conditions, often to perish. The camps were established by Lenin, expanded by Stalin and finally exposed to the world by the great Russian author Aleksandr Solzhenitsyn, with his 1973 masterpiece, ""The Gu",1,0,0,0,0
eng-4514192,Controversy surrounding Trump's Bedminster club grows more serious,2019-01-01,0.07450980392156858,"news/Politics, dmoz/Society/Work, dmoz/Society/Issues/Immigration, dmoz/Sports/Golf",United States,Noth America,13,13,"About a month ago, the New York Times published a striking portrait of a Guatemalan immigrant named Victorina Morales, who entered the United States illegally many years ago, and in 2013, began working at the Trump National Golf Club in Bedminster, N.J. As a presidential candidate, Donald Trump assured voters he hadn't hired ""illegal immigrants."" Morales wanted the world to know that wasn't true.  At first, this looked like a story about a brave woman, coming forward despite the risks to her pers",1,0,1,0,0
eng-4511722,"'What Will I Not Miss?' In California, a Long Farewell From Jerry Brown",2019-01-01,0.1058823529411765,news/Politics,United States,Noth America,35,35,"WILLIAMS, Calif. -- It's time to add another name to the farewell tour circuit in this year of Elton John, Joan Baez, Paul Simon and Ozzy Osbourne: Edmund G. Brown Jr., the governor of California.  There was the invitation-only reception for 2,000 guests at a Sacramento basketball arena; the appearance on ""Meet the Press"" this past Sunday to talk about President Trump and offer dark warnings about global warming; and the interviews with The Los Angeles Times, The Sacramento Bee and many others. O",1,0,0,0,0
eng-4511370,NYC traffic injuries are up despite drop in fatalities,2019-01-01,-0.1215686274509804,"news/Politics, dmoz/Society/Issues/Transportation, dmoz/Recreation/Roads and Highways/Online Traffic Cameras, dmoz/Society/Death/Near Death Experiences",United States,Noth America,6,6,"Traffic deaths may be down under Mayor de Blasio's Vision Zero program, but there are more crashes since the program began and a steadily rising injury toll, ­according to NYPD data.  Collisions on city streets increased more than 11 percent between 2014 and 2018, statistics show. In 2014, there were 205,486, and that number rose to 228,227 in 2018.  During that same time, collisions resulting in injuries increased by 18 percent, from 37,556 in 2014 to 44,508 in 2018.  Overall injuries are also ",1,0,0,0,0
eng-4511244,"For Bernie Sanders, Claims of Sexism in 2016 Campaign Hang Over 2020 Bid",2019-01-01,-0.08235294117647063,"news/Politics, dmoz/Society/Issues/Violence and Abuse, dmoz/Society/Politics/Campaigns and Elections, dmoz/Society/Sexuality",United States,Noth America,109,109,"In February 2016, Giulianna Di Lauro, a Latino outreach strategist for Senator Bernie Sanders's presidential operation, complained to her supervisor that she had been harassed by a campaign surrogate whom she drove to events ahead of the Democratic primary in Nevada.  She said the surrogate told her she had ""beautiful curly hair"" and asked if he could touch it, Ms. Di Lauro said in an interview. Thinking he would just touch a strand, she consented. But she said that he ran his hand through her ha",1,0,1,1,0
eng-4505121,Netflix criticized for yanking comedian's episode in Saudi,2019-01-01,-0.2784313725490196,"news/Arts and Entertainment, dmoz/Society/Issues, news/Politics, dmoz/Arts/Television/Programs, dmoz/Home/Consumer Information/Arts and Entertainment",Turkey,Asia,605,541,"Human rights group Amnesty International said Saudi Arabia's censorship of Netflix is ""further proof of a relentless crackdown on freedom of expression."" Netflix said it was simply complying with a local law.  Netflix faced criticism Wednesday from human rights groups for pulling an episode in Saudi Arabia of comedian Hasan Minhaj's ""Patriot Act"" series that criticized the kingdom's powerful crown prince.  The American comedian used his second episode, released Oct. 28, to criticize Crown Prince ",1,1,1,1,1
eng-4502815,"Bulandshahr: Inspector Subodh Kumar Singh became 'hopeless' and shot himself, claims BJP MLA",2018-12-29,-0.3490196078431372,"dmoz/Society/Law/Law Enforcement, dmoz/Society/Issues/Violence and Abuse, news/Politics",India,Asia,29,54,"Devendra Singh Lodhi also claimed that the policeman was not specifically targeted in the violence.  A Bharatiya Janata Party MLA from Uttar Pradesh on Friday claimed that Inspector Subodh Kumar Singh, who was among two people killed in Bulandshahr district earlier this month, shot himself after he became ""hopeless"", ANI reported.  ""While trying to save himself, the cop became hopeless and fired at himself in haste,"" said Devendra Singh Lodhi. ""He was not targeted by anyone; it was a mob that got",0,1,0,0,0
eng-4505965,"India, Pakistan Exchange Lists Of Prisoners",2019-01-01,0.003921568627450966,"news/Politics, dmoz/Society/Crime/Prisons, dmoz/Society/Issues/Crime and Justice, dmoz/Computers/Artificial Life/Iterated Prisoner Dilemma",Pakistan,Asia,53,53,"NEW DELHI -- India and Pakistan Tuesday exchanged details of civilian prisoners and fishermen lodged in each other's jails.The Ministry of External Affairs or MEA said India handed over to Pakistan lists of 249 Pakistani civilian prisoners and 98 fishermen in its custody.Pakistan has shared lists of 54 civilian prisoners and 483 fishermen in its custody, who are Indians or are believed-to-be-Indians.The lists were exchanged in keeping with the provisions of a 2008 agreement under which such lists",0,1,0,0,0
eng-4504970,Why Is Trump Spouting Russian Propaganda?,2019-01-01,-0.02745098039215688,"dmoz/Society/Issues, news/Politics, dmoz/Society/Issues/Peace, dmoz/Society/Issues/Warfare and Conflict",Afghanistan,Asia,375,381,"The president's endorsement of the U.S.S.R.'s invasion of Afghanistan echoes a narrative promoted by Vladimir Putin.  It was only one moment in a 90-minute stream of madness.  President Donald Trump convened a Cabinet meeting, at which he invited all its members to praise him for his stance on the border wall and the government shutdown. There's always a lively competition to see which member of the Cabinet can grovel most abjectly. The newcomer Matthew Whitaker may be only the acting attorney ge",0,1,0,0,0
eng-4506449,Desperate migrants are found hiding in MATTRESSES,2019-01-01,-0.05882352941176472,"news/Politics, dmoz/Shopping/Home and Garden/Walls, dmoz/Society/Issues/Labor",Spain,Europe,15,15,"Footage shows guards cutting through plastic and fabric to reveal men inside  This is the extraordinary moment two migrants emerged from inside mattresses during their bid to reach Europe from Africa.  The sub-Saharan men were arrested after border guards found them at a check-point between Melilla, a Spanish enclave on the north African coast, and Morocco.  It is understood to be the first time the method has been used to smuggle migrants and there are fears criminal gangs could increasingly use",0,1,0,0,0
eng-4507173,Slain Archana's daughter tearfully recalls last hug,2019-01-01,-0.192156862745098,"news/Politics, dmoz/Society/Law/Law Enforcement",India,Asia,90,90,"New Delhi: Not a single person in the family had thought that it would be their last hug until the shots were fired. The joy of New Year turned into grief for the Gupta family as the 42-year-old architect, who sustained head injuries from a bullet fired by a family friend, succumbed to her injuries on Wednesday.  Victim Archana's daughter, Hoshika Gupta, hadn't imagined even in her wildest dreams that the hug her mother gave her would be the last one as minutes after the hug she was shot by a fam",0,1,0,0,0
eng-4507803,"Aligarh: 60 stray cattle die in a week due to 'cold and weakness', say police",2019-01-01,0.04313725490196085,"news/Politics, dmoz/Society/Issues/Animal Welfare, dmoz/Recreation/Humor/Animals",India,Asia,39,48,"After coming to know about the deaths, a team of district administration, including veterinary doctors and police, rushed to the spot to inquire into the incident on Monday.  In the last one week, as many as 60 stray cattle, including cows and calves, kept in a makeshift shed died of ""cold and weakness"" in Tappal area of Aligarh district, police said.  Police had transported 1,800 cattle in the last one week to a cow shelter run by one Shiv Dutt Sharma at Jarkari town, but the latter shifted most",0,1,0,0,0
eng-4514842,City of Keene in Dispute with Local Restaurant Owner Over 'Pho Keene Great' Name,2019-01-01,0.09019607843137245,"news/Politics, dmoz/Business/Business Services/Signage, dmoz/Recreation/Roads and Highways/Signs and Signals, dmoz/Recreation/Food/Dining Guides",United States,Noth America,11,11,"The City of Keene is asking a Vietnamese restaurant slated to open this spring to change its name.  The restaurant has a lease with the city to operate out of the same building as City Hall.  But its proposed name, Pho Keene Great, has prompted complaints, said City Manager Elizabeth Dragon.  Pho, pronounced ""fuh,"" is a kind of Vietnamese soup. ""Pho Keene"" is intended to sound like a profanity, Dragon said.  Under the terms of the lease, the restaurant must get permission from the city before han",0,1,0,0,0
eng-4515847,Analysis | Britain clings to imperial nostalgia as Brexit looms,2019-01-01,0.1607843137254903,"dmoz/Society/Issues, dmoz/Society/Government, news/Politics, dmoz/Society/Issues/Economic",-,-,16,16,"By Ishaan Tharoor Ishaan Tharoor Reporter covering foreign affairs, geopolitics and history January 4 at 12:59 AM  Want smart analysis of the most important news in your inbox every weekday along with other global reads, interesting ideas and opinions to know? Sign up for the Today's WorldView newsletter.  (Adrian Dennis)  British Prime Minister Theresa May may be on her last legs. Last month, she delayed a parliamentary vote on her much-maligned Brexit deal with Brussels, fearing it would go dow",0,0,1,0,0
eng-4514589,New sheriffs in town as African Americans win top law enforcement posts in N.C.,2019-01-01,-0.09019607843137256,"news/Politics, dmoz/Society/Issues/Immigration, dmoz/Recreation/Climbing/Ice Climbing, dmoz/Games/Party Games/Icebreaker Games",United States,Noth America,9,9,"By Barry Yeoman January 4 at 7:00 AM  DURHAM, N. C. -- Three days after he was sworn in as Durham County's new sheriff last month, Clarence Birkhead ended his department's cooperative relationship with U.S. Immigration and Customs Enforcement. Within a week, Birkhead's staff rebuffed ICE 11 times, releasing immigrants from the county jail rather than holding them for the federal agency to pick up as a first step toward deportation.  Other new sheriffs were doing much the same. In Mecklenburg and ",0,0,1,0,0
eng-4513777,'Electronic Wall' E-Verify Suspended As Border Security Shutdown Fight Persists,2019-01-01,-0.05882352941176472,"news/Politics, dmoz/Society/Issues/Immigration, dmoz/Society/Transgendered/Law, dmoz/Society/Genealogy/Emigration and Immigration",-,-,25,25,"The government shutdown began with the president's demand for border security money. But it's also shut down E-Verify, a federal program that's supposed to prevent immigrants from working illegally.  If U.S. employers want to check whether their prospective hires are eligible to work, they can't. The E-Verify database is ""currently unavailable due to a lapse in government appropriations,"" according to a note on the government-run web site.  ""There's an irony there,"" says Julie Pace, an attorney s",0,0,1,0,0
eng-4512676,Opinion | Kamala Harris's Dark Knights,2019-01-01,0.03529411764705892,"dmoz/Society, news/Politics, dmoz/Society/Politics, dmoz/Society/Relationships/Marriage",United States,Noth America,5,5,"By The Editorial Board The Editorial Board The Wall Street Journal BiographyThe Editorial Board @WSJopinion WSJOpinion Jan. 2, 2019 6:57 p.m. ET  We're still a year from the 2020 presidential primaries, but Senator Kamala Harris is already showing America how far the Democratic Party has strayed from its roots.  Democrats rightly take pride in the 1928 nomination of Gov. Al Smith, which signaled the party's affirmation that Catholics had a place in American public life. Ditto for Jack Kennedy, wh",0,0,1,0,0
eng-4512539,Turkey seeks nearly 150 arrests over Gulen ties: report - Global Village Space,2019-01-01,-0.2470588235294118,"dmoz/Society/Issues, news/Politics, dmoz/Society/Issues/Warfare and Conflict, dmoz/Society/Issues/Terrorism",Turkey,Asia,20,20,"Turkish police on Friday launched nationwide raids to detain nearly 150 people, including military personnel, suspected of ties to the group blamed for the 2016 attempted coup, local media reported.  Prosecutors in Istanbul, Konya and Ankara issued arrest warrants for 137 people as part of different investigations into followers of US-based Muslim preacher Fethullah Gulen, state news agency Anadolu and NTV broadcaster reported.  Tens of thousands of people have been arrested over alleged links to",0,0,1,0,0
eng-4511089,Opinion | Republicans should be alarmed by this sign of intelligent life in the Democratic Party,2019-01-01,0.2,"news/Politics, dmoz/Society/Politics, dmoz/Society/Politics/Campaigns and Elections, dmoz/Society/Gay, Lesbian, and Bisexual/Politics",United States,Noth America,5,5,"By George F. Will George F. Will Columnist covering politics and domestic and foreign affairs Columnist January 2 at 6:04 PM  If Republicans have a lick of sense, they are alarmed by a recent sign of intelligent life in the other party. The sign is the election by Democrats in the House of Representatives of Rep. Cheri Bustos (Ill.) as chair of the Democratic Congressional Campaign Committee. In November, she won a fourth term by 24 percentage points -- the largest margin of any Democrat running ",0,0,1,1,0
eng-4511026,Kansas Sen. Pat Roberts announces he won't seek reelection in 2020,2019-01-01,0.1058823529411765,"news/Politics, dmoz/Society/Politics/Campaigns and Elections, dmoz/Society/Gay, Lesbian, and Bisexual/Politics, dmoz/Society/Government/Parliaments and Legislatures",United States,Noth America,56,59,"By Dave Weigel and Sean Sullivan Sean Sullivan Reporter covering national politics January 4 at 12:35 PM  Sen. Pat Roberts, the blunt-speaking Kansan who worked closely with Democrats on helping the nation's farmers and protecting food stamps for millions of low-income Americans, announced Friday that he would not seek reelection in 2020.  Roberts, 82, who had conferred with his family over the holidays, said at a news conference in Manhattan, Kan., ""I am announcing that I will serve the remainde",0,0,1,0,0
eng-4510195,Texas County Swears In 17 Black Female Judges In 'Extraordinary Moment In History',2019-01-01,0.1137254901960785,"news/Politics, dmoz/Society/Politics/Campaigns and Elections",United States,Noth America,27,27,"New representation and Black Girl Magic came to a Texas county this week when 17 black women were sworn in as new judges.  The newly-elected officials made headlines in November when they won their races for various courts in Harris County, which includes Houston and surrounding areas. They were sworn in on Tuesday.  ""January 1, 2019 at noon will be an extraordinary moment in history for all of us in Harris County, Houston, Texas,"" Judge LaShawn Williams wrote on Facebook last month ahead of the ",0,0,1,1,0
eng-4517828,What It Looks Like To Have A Record Number Of Women In The House Of Representatives,2019-01-01,0.1058823529411765,"dmoz/Sports/Women, news/Politics, dmoz/Health/Women's Health/Smoking, dmoz/Health/Women's Health/Organizations",-,-,19,19,"One hundred twenty-seven. That's how many women will be in Congress this year, up from 110 in the previous Congress.  It's a jump that's simultaneously so big and so small.  On the one hand, there are 15 percent more women in this Congress than there were last session. There are now a record number of women of color in the House. There are also a slew of firsts: Congress will get its first Native American women, Muslim women, and youngest woman member ever.  On the other hand, this year's record-",0,0,0,1,0
eng-4505657,House passes bill to end US government shutdown without border wall money,2019-01-01,0.05882352941176472,"news/Politics, dmoz/Society/Issues/Housing, dmoz/Business/Real Estate/Residential, dmoz/Shopping/Home and Garden/Walls",-,-,2798,2331,"Fog surrounds the U.S. Capitol building on November 6, 2018 in Washington, DC. Today millions of Americans will head to the polls and vote in the midterm elections that will decide what party will control the House of Representatives and the U.S. Senate.  The new Democratic-held House passed legislation Thursday night that would end a partial government shutdown.  Passage of the spending packages will not move Congress closer to reopening nine unfunded federal departments for now. As the measures",0,0,0,1,1
eng-4515340,Lots of People in Delaware Seem Cool With This Racist Parade,2019-01-01,-0.09019607843137256,"dmoz/Society/Issues, news/Politics, dmoz/Society/Gay, Lesbian, and Bisexual/Pride Celebrations",United States,Noth America,11,11,"There's nothing funny about Border Patrol agents pepper spraying immigrants, or children being separated from their families. The deaths of two children in the custody of U.S. immigration authorities is nothing to laugh at.  And yet the ""Hummers Parade,"" an annual event in Middletown, DE, decided it was cool to mock all of these things. The parade, a spoof of Philadelphia's annual Mummers Parade, has apparently been running for 48 years.  The parade ""has no registration, membership, or rules. It'",0,0,0,1,0
eng-4510054,New House rules to allow Democrats to defend Obamacare,2019-01-01,0.192156862745098,"dmoz/Society/Law, news/Politics, dmoz/Society/Transgendered/Law, dmoz/Society/Law/Legal Information",United States,Noth America,42,42,"Chat with us in Facebook Messenger. Find out what's happening in the world as it unfolds.  (CNN)House Democrats are moving quickly to defend the Affordable Care Act once they retake control of the chamber Thursday.  As part of its rules package for the 116th Congress, the party is granting itself authorization to intervene in the lawsuit that threatens to bring down the landmark health reform law. It directs the House's Office of General Counsel to represent lawmakers in any litigation involving ",0,0,0,1,0
eng-4509653,Ocasio-Cortez Rips Dem Leadership for Treating Planet-Saving Green New Deal as 'Controversial',2019-01-01,0.05098039215686279,"news/Politics, dmoz/Science/Environment/Climate Change, dmoz/Society/Issues/Environment, dmoz/Science/Earth Sciences/Paleogeography and Paleoclimatology",-,-,73,73,"Incoming Rep. Alexandria Ocasio-Cortez took aim at the Democratic Party on Monday over the newly-announced climate crisis committee -- a body she and other progressives say lacks the teeth needed to avert planetary disaster.  In a Twitter thread, Ocasio-Cortez said that her proposal for a select committee on a Green New Deal -- a key demand of the youth-led Sunrise Movement -- contained ""3 simple elements: 1. No fossil fuel money on climate cmte 2. Offer solutions for impacted communities 3. Draf",0,0,0,1,0
eng-4509595,"Oregon man tries stealing bike in front of police station, immediately gets arrested",2019-01-01,-0.2627450980392156,"news/Politics, dmoz/Sports/Cycling/Bike Shops, dmoz/Shopping/Sports/Cycling, dmoz/Society/Law/Law Enforcement",United States,Noth America,19,19,"WATCH Man arrested after attempting to steal bike from in front of police station  It's almost like he planned to get caught.  An Oregon man was arrested last week for trying to steal a bike that was locked up at the front door of a police station in Gladstone, about 10 miles south of Portland.  The Gladstone Police Department caught it on surveillance video. The footage shows suspect Adam Valle, 26, wearing a mask as he cuts the lock off the bike with a bolt cutter, just before Sgt. Matt Okerman",0,0,0,1,0
eng-4508388,Melania Trump posts festive New Year's selfie after Mar-a-Lago bash,2019-01-01,0.3254901960784313,"news/Politics, dmoz/Society/Government/Government-Related Organizations",United States,Noth America,5,9,"Coverage of First Lady Melania Trump has been subjected to harsh treatment at the hands of everyone from late-night comedians to mainstream news organizations. From mocking her accent, to slamming her choices of Christmas décor, Melania is constantly mocked and attacked by prominent liberals and media members. Here are some of the most over-the-top attacks on the first lady of 2018.  Melania Trump took a festive New Year's selfie and posted it to her Twitter account, and the media has yet to tak",0,0,0,1,0
eng-4505605,Manchester Victoria station stabbings treated as terror attack,2019-01-01,-0.3647058823529412,"news/Politics, dmoz/Society/Issues/Warfare and Conflict, dmoz/Society/Law/Law Enforcement, dmoz/Society/Issues/Terrorism",United Kingdom,Europe,317,347,"A 25-year-old man was arrested on suspicion of attempted murder after the incident, which happened shortly before 9pm.  Two knives were recovered at the scene and a property is being searched in the Cheetham Hill area.  In a briefing on Tuesday morning, police said they were keeping an open mind about the motive.  They have not yet confirmed whether the suspect is a British national.  The three victims were taken to a nearby hospital in a ""serious"" condition but their injuries are not thought to ",0,0,0,0,1
eng-4505406,"Kim and Trump Back at Square One: If U.S. Keeps Sanctions, North Will Keep Nuclear Program",2019-01-01,0.08235294117647052,"dmoz/Society/Issues, news/Politics, dmoz/Society/Issues/Warfare and Conflict, dmoz/Sports/Martial Arts/Korean",North Korea,Asia,639,649,"Nearly two years into his presidency and more than six months after his historic summit meeting with Kim Jong-un of North Korea, President Trump finds himself essentially back where he was at the beginning in achieving the ambitious goal of getting Mr. Kim to relinquish his nuclear arsenal.  That was the essential message of Mr. Kim's annual New Year's televised speech, where he reiterated that international sanctions must be lifted before North Korea will give up a single weapon, dismantle a sin",0,0,0,0,1
