uri,title,event_date,sentiment,categories,loc_country,loc_continent,article_count,total_article_count,summary,nytimes,indiatimes,washingtonpost,usatoday,chinadaily
eng-4505427,Trump: Iran 'can do what they want' in Syria,2019-01-01,-0.02745098039215688,"dmoz/Society/Issues, news/Politics, dmoz/Society/Issues/Warfare and Conflict",-,-,209,244,"WASHINGTON -- US President Donald Trump on Wednesday gave Iran free rein to further entrench itself in Syria, acknowledging Tehran's attempts to bolster its presence in the beleaguered country.  ""They can do what they want there, frankly,"" he told reporters, referring to Iranian forces.  Trump's comments came two weeks after he rattled Jerusalem by announcing that he would pull all American troops out of Syria. US soldiers had been leading the coalition against the Islamic State terror group, whi",0,0,0,0,1
eng-4504743,"Taiwan won't give ground on sovereignty, Tsai Ing-wen says in new year address",2019-01-01,0.2,"dmoz/Society/Issues/Territorial Disputes, news/Politics, dmoz/Business/Mining and Drilling/Conferences, dmoz/Business/Chemicals/Biochemical",Taiwan,Asia,31,46,"Taipei will not give any ground on sovereignty despite the ruling Democratic Progressive Party's landslide defeat in local government elections late last year, the island's leader said ahead of a major speech on Taiwan by Chinese President Xi Jinping.  In late November, the opposition Kuomintang won control of 15 of 22 cities and counties - including the former DPP stronghold of Kaohsiung, a result some politicians said reflected public support for the KMT's more Beijing-friendly policies.  But T",0,0,0,0,1
eng-4505784,"Cooperation best for both China and U.S., Xi tells Trump",2019-01-01,0.3960784313725489,"news/Politics, dmoz/Society/Issues/Economic, dmoz/Business/Mining and Drilling/Conferences, dmoz/Business/Chemicals/Biochemical",China,Asia,26,30,"BEIJING (Reuters) - History shows that cooperation is the best choice for both China and the United States, Chinese President Xi Jinping told U.S. President Donald Trump in a congratulatory message on Tuesday to mark 40 years since the establishment of diplomatic relations.  The two countries agreed last month to a 90-day temporary ceasefire in their bitter trade war to give them time to hold fresh talks to try and end a dispute that has seen them level increasingly severe tariffs on each others'",0,0,0,0,1
eng-4504672,Baby saved after 35 hours in subzero conditions following Russia blast,2019-01-01,-0.2392156862745098,"news/Politics, dmoz/Business/Construction and Maintenance/Building Types, dmoz/Business/Chemicals/Explosives, dmoz/Computers/Software/Build Management",Russia,Europe,407,550,"A 10-month old boy was rescued alive after spending more than 35 hours in subzero conditions buried under the rubble of a collapsed building in Russia.  Emergency crews temporarily suspended their search for survivors Tuesday amid fears that remnants of the 10-story apartment block were too unstable following the deadly New Year's Eve gas explosion.  But a short time later rescuers heard a child crying and rushed to save it, regional Gov. Boris Dubrovsky said on his official Telegram account. Dub",0,0,0,0,1
eng-4506156,"As Hong Kong tightens screws on rebellion, democracy moves further out of reach",2019-01-01,0.06666666666666665,"dmoz/Society/Issues/Territorial Disputes, news/Politics, dmoz/Society/Politics, dmoz/Society/Politics/Democracy",China,Asia,38,38,"Chat with us in Facebook Messenger. Find out what's happening in the world as it unfolds.  Hong Kong (CNN)""If this is the cup I must take, I will drink with no regret.""  Benny Tai was defiant and emotional as he faced the court. Outside, he and his fellow defendants raised their fists and supporters displayed yellow umbrellas, the symbol of Hong Kong's beleaguered pro-democracy movement. That movement is looking shakier than ever, as Tai and others begin the new year facing possible jail time -- ",0,0,0,0,1
spa-1427574,Brazil's new far-right President removes protections for Indigenous people,2019-01-01,0.09019607843137245,"dmoz/Society/Issues, news/Politics, dmoz/Society/Politics, dmoz/Society/Issues/Economic",Brazil,South America,1457,362,"Brazil's new far-right President Jair Bolsonaro has stripped the government department charged with protecting the country's Indigenous people of much of its responsibilities, which distressed critics say could lead to the destruction of dozens of tribes.  Brazilian newspaper Folha de S.Paulo reported the decision was announced just hours after the new President was sworn in as the country's leader on Tuesday (local time), and confirmed a pre-election pledge to roll back Indigenous rights and pro",0,0,0,0,1
eng-4506250,"AI predictions for 2019 from Yann LeCun, Hilary Mason, Andrew Ng, and Rumman Chowdhury",2019-01-01,0.2313725490196079,"news/Technology, dmoz/Computers/Artificial Intelligence/Games, dmoz/Computers/Artificial Intelligence/Philosophy, dmoz/Computers/Artificial Intelligence/Publications",-,-,53,53,"Above: Left to right: Cloudera machine learning general manager Hilary Mason, Accenture global responsible AI lead Rumman Chowdhury, Facebook AI Research director Yann LeCun, and Google Brain cofounder Andrew Ng  Artificial intelligence is cast all at once as the technology that will save the world and end it.  To cut through the noise and hype, VentureBeat spoke with luminaries whose views on the right way to do AI have been informed by years of working with some of the biggest tech and industry",1,1,0,0,0
eng-4510590,"Big Tech May Look Troubled, but It's Just Getting Started",2019-01-01,0.01960784313725483,"news/Technology, dmoz/Computers/Internet/Searching, dmoz/Society/Issues/Business, dmoz/Business/Information Technology/Marketing and Advertising",United States,Noth America,7,7,"SAN JOSE, Calif. -- Silicon Valley ended 2018 somewhere it had never been: embattled.  Lawmakers across the political spectrum say Big Tech, for so long the exalted embodiment of American genius, has too much power. Once seen as a force for making our lives better and our brains smarter, tech is now accused of inflaming, radicalizing, dumbing down and squeezing the masses. Tech company stocks have been pummeled from their highs. Regulation looms. Even tech executives are calling for it.  In the f",1,0,0,0,0
eng-4511411,Ocean Cleanup device in Great Pacific Garbage Patch breaks,2019-01-01,0.04313725490196085,"news/Technology, dmoz/Recreation/Collecting/Patches, dmoz/Science/Earth Sciences/Oceanography, dmoz/Business/Chemicals/Polymers",United States,Noth America,28,28,"SAN FRANCISCO -- A 60-foot chunk of the Ocean Cleanup device, deployed with much fanfare in the Great Pacific Garbage Patch in October, has broken off and the entire plastic collection system will now be towed back to port for an overhaul and upgrade.  The break was discovered on Dec. 29 during a routine inspection by the cleanup system's crew. A 60-foot end section of the 2,000-foot boom that corrals the plastic had detached, Boyan Slat, the Cleanup's CEO, posted on the Dutch non-profit's blog o",1,0,0,1,0
eng-4515761,Huawei demotes two employees and cuts their pay after tweeting from iPhone,2019-01-01,0.04313725490196085,"news/Technology, dmoz/Business/Human Resources/Employee Relations, dmoz/Computers/Systems/Handhelds, dmoz/Computers/Security/Virtual Private Networks",-,-,156,156,"Huawei has demoted and cut the pay of two of its employees after an iPhone was used to send a New Year's greeting from the company's official Twitter account. In a memo seen by both Reuters and Bloomberg, the company's corporate senior vice president Chen Lifang said that the incident had ""caused damage to the Huawei brand."" In addition to the demotion and a 5,000 yuan (around $728) monthly pay cut, the January 3rd memo said that one of the employees would also see their pay rank frozen for 12 mo",1,0,0,0,0
eng-4507395,"Hacker Group Releases '9/11 Papers', Claims Leaks Will 'Burn Down' the US Deep State",2019-01-01,-0.2549019607843137,"news/Technology, dmoz/Society/Law/Legal Information, dmoz/Society/Issues/Terrorism, dmoz/Computers/Hacking",-,-,47,47,"The document dump is just a fraction of the 18,000 secret documents related to the September 11, 2001 terrorist attacks believed to have been stolen from insurers, law firms, and government agencies.  The Dark Overlord initially threatened to release the 10GB of data unless the hacked firms paid an unspecified bitcoin ransom. However, on Wednesday, the group announced a ""tiered compensation plan"" in which the public could make bitcoin payments to unlock the troves of documents.  A day later, the ",0,1,0,0,0
eng-4507905,Google wins US approval for new radar-based motion sensor,2019-01-01,0.2862745098039217,"news/Technology, dmoz/Computers/Internet/Searching, dmoz/Business/Electronics and Electrical/Instrumentation",-,-,81,81,"Alphabet Inc's Google unit won approval from US regulators to deploy a radar-based motion sensing device known as Project Soli.  The Federal Communications Commission (FCC) said in an order late on Monday that it would grant Google a waiver to operate the Soli sensors at higher power levels than currently allowed. The FCC said the sensors can also be operated aboard aircraft.  The FCC said the decision ""will serve the public interest by providing for innovative device control features using touch",0,1,1,0,0
eng-4505527,"Artificial Intelligence could be first 'resident' on Mars, hints Musk",2019-01-01,0.003921568627450966,news/Technology,-,-,16,21,"Responding to a tweet that asked Musk what his thoughts were on the first Martian being an intelligent machine rather than a human, he replied: ""30%.""  Tech billionaire and SpaceX CEO Elon Musk wants to establish a base on Mars, and he has indicated the first resident on the planet could be Artificial Intelligence (AI).  Responding to a tweet that asked Musk what his thoughts were on the first Martian being an intelligent machine rather than a human, he replied: ""30%.""  How Musk came up with this",0,1,0,0,0
eng-4510331,'Workaround systems' help print US newspapers hit by cyber attack: source,2019-01-01,-0.1529411764705882,"news/Technology, dmoz/Business/Publishing and Printing, dmoz/Society/Issues/Warfare and Conflict, dmoz/Society/Issues/Terrorism",United States,Noth America,12,12,"It is the latest in a string of cyber attacks that have disrupted operations at manufacturing plants, hospitals, 911 emergency dispatch centers and companies around the world.  Tribune Publishing Co used ""workaround systems"" to help print major US newspapers including the Los Angeles Times on Sunday and Monday as the company recovers from a cyber attack, a source familiar with the operation said.  The company has made ""lots of progress"" in repairing infected computer systems, the person said. Sti",0,0,1,0,0
eng-4510500,Ajit Pai thanks Congress for helping him kill net neutrality rules,2019-01-01,0.08235294117647052,"news/Technology, dmoz/Society/Law/Legal Information, dmoz/Computers/Internet/Publications, dmoz/Computers/Internet/Policy",United States,Noth America,28,28,"Democratic effort to reverse repeal fell short as Congressional session ended.  Ajit Pai today celebrated a victory in his ongoing quest to prevent the US government from enforcing net neutrality rules.  The Pai-led Federal Communications Commission repealed Obama-era net neutrality rules, but the repeal could have been reversed by Congress if it acted before the end of its session. Democrats won a vote to reverse the repeal in the Senate but weren't able to get enough votes in the House of Repre",0,0,1,0,0
eng-4510937,Earthquake early warning app for LA County available for download,2019-01-01,0.0117647058823529,"news/Technology, dmoz/Science/Earth Sciences, dmoz/Science/Earth Sciences/Geophysics, dmoz/Shopping/Antiques and Collectibles/Religious and Inspirational",United States,Noth America,50,50,"Mayor Eric Garcetti tweeted this image of the ShakeAlertLA app. (mayorofla/Twitter)  When the big one comes, even seconds of warning prior to shaking could save your life. And if you live in Los Angeles County, the ShakeAlertLA app could do just that.  The app is now available for download for Apple and Android phones. Those who download the app would receive a push alert, possibly up to 20 seconds before an earthquake hits L.A. County.  MORE: USGS, Caltech officials announce rollout of West Coas",0,0,1,1,0
eng-4508358,Huawei Mate 20 Pro vs Google Pixel 3 XL review | TheINQUIRER ,2019-01-01,0.1529411764705881,"news/Technology, dmoz/Computers/Internet/Searching",-,-,47,47,"THESE DAYS, phone users want their devices to boast epic cameras, and the Huawei Mate 20 Pro and Google Pixel 3 XL are by far the most impressive the market has to offer right now.  But which handset has the edge? And what about battery life, screen, design and performance? If we were to compare all the features that make a great smartphone between these two handsets, which one would win?  Well, that's exactly what we're about to find out. We've pitted the Mate 20 Pro and Pixel 3 XL in a battle o",0,0,0,1,0
eng-4516352,"Amazon Alexa a ""DEMON device"" that gathers information that can be used to blackmail you for life",2019-01-01,0.2392156862745098,news/Technology,-,-,30,30,"(Natural News) Millions of unwitting ""sheeple"" have willingly outfitted their homes and offices with so-called ""smart"" speakers like Amazon's Alexa device, which is marketed as a convenience assistant for getting things done simply using only your voice. But as revealed by Justus Knight in a recent video update to his YouTube channel, Alexa is, practically speaking, an always-listening demon device that can monitor, track, and record people's conversations for blackmail purposes.  The epitome of ",0,0,0,1,0
eng-4516973,8 Tricks to Improve the Picture on Your New TV,2019-01-01,0.2078431372549019,"news/Technology, dmoz/Arts/Television/Guides, dmoz/Arts/Television/Schedule and Programming, dmoz/Arts/Television/Interactive",-,-,16,16,"Right now is one of the best times to buy a new TV. In early January, TV makers will announce their 2019 sets at CES, so all the 2018 set will be cheaper than usual as companies work to burn off their old inventory. And seeing as all those new, 2019 TVs won't start showing up in stores until March, at the earliest you've got a few months to enjoy your set without being envious of others. But you know what will make your TV even more enjoyable? These tricks for significantly improving its image qu",0,0,0,1,0
eng-4516729,Apple Beware: Samsung's Great Fall in China Was Swift ,2019-01-01,0.1137254901960785,"news/Technology, dmoz/Computers/Systems/Apple, dmoz/Computers/Hardware/Retailers, dmoz/Business/Chemicals/Biochemical",China,Asia,10,10,"In five years, Samsung went from China's No. 1 to less than 1% market share By Timothy W. Martin Timothy W. Martin The Wall Street Journal BiographyTimothy W. Martin @timothywmartin Google+ Timothy.Martin@wsj.com Jan. 4, 2019 7:20 a.m. ET  SEOUL -- Apple Inc.'s AAPL 4.27% recently revealed stumble in China is an all-too-familiar story for smartphone rival Samsung Electronics Co.  Five years ago, the South Korean technology giant sat atop the Chinese market, selling nearly one of every five device",0,0,0,0,1
eng-4506731,Winds improve Delhi air; pollution likely to ease up,2019-01-01,-0.1137254901960785,"dmoz/Science/Environment/Air Quality, news/Environment, dmoz/Shopping/Home and Garden/Climate Control, dmoz/Science/Technology/Quality Engineering",India,Asia,77,77,"New Delhi, Jan 4 (IANS) Despite adverse meteorological conditions, a sudden increase in wind speed improved the toxic air quality of the national capital to 'very poor' on Friday and as per the Met, it is likely to improve a few more notches over the next few days.  ""Despite unfavourable meteorological conditions including a dense fog, the overall air quality in Delhi has improved from 'severe' to 'very poor' category due to an appreciable increase in wind speed (4.1 km/hr).  ""It is likely to imp",0,1,0,0,0
eng-4511610,How A YouTube Yoga Channel Helped Me Get Over My Fear Of Working Out,2019-01-01,0.1294117647058823,"news/Health, dmoz/Society/Religion and Spirituality/Yoga",-,-,24,24,"Apparently, there's nothing my body loves more than starting a new year off by coming down with the flu. Last January, I stayed in bed for almost two weeks, and it did weird things to my head: I was sick and bored and actually angry at my body. I devoted so much headspace to feeling weak and pathetic that I started to give in to the fear that maybe I was a weak and pathetic person. Even when I started to regain my energy, I couldn't bring myself to hit the gym or even venture outside for a brisk,",1,0,0,0,0
eng-4516088,Opinion | A great first step to protect antibiotics for the future,2019-01-01,0.06666666666666665,"news/Health, dmoz/Health/Pharmacy/Drugs and Medications, dmoz/Health/Animal/Drugs and Medications, dmoz/Society/Issues/Animal Welfare",-,-,11,11,"By Editorial Board January 1 at 4:58 PM  VERY PROMISING news about antibiotic use in farm animals has come from the Food and Drug Administration. The problem of resistance -- the tendency of bacteria to fight back against antibiotic drugs -- has been growing for decades, fueled by overuse and misuse of antibiotics in human health, as well as widespread and often indiscriminate use in farm animals. But new data shows the use of antibiotics in animal agriculture has taken a marked downward turn.  A",0,0,1,0,0
eng-4516664,Tainted drugs: When medicine makes patients sicker,2019-01-01,0.03529411764705892,"news/Health, dmoz/Health/Pharmacy/Drugs and Medications, dmoz/Health/Teen Health/Drugs and Alcohol, dmoz/Shopping/Health/Home Tests",United States,Noth America,19,19,"This is a Kaiser Health News story.  The Food and Drug Administration is supposed to inspect all factories, foreign and domestic, that produce drugs for the U.S. market. But a KHN review of thousands of FDA documents -- inspection records, recalls, warning letters and lawsuits -- reveals how drugs that are poorly manufactured or contaminated can reach consumers.  Despite the jackhammer-like rhythm of a mechanical ventilator, Alicia Moreno had dozed off in a chair by her 1-year-old's hospital bed,",0,0,1,0,0
eng-4506674,How to start the Mediterranean diet (and stay on it),2019-01-01,0.2,"news/Health, dmoz/Health/Nutrition/Dietary Options, dmoz/Health/Weight Loss/Support Groups, dmoz/Health/Weight Loss/Articles",-,-,105,105,"Chat with us in Facebook Messenger. Find out what's happening in the world as it unfolds.  (CNN)A diet that's good for healthy weight loss? Check. One that reduces the risk for diabetes, high cholesterol, heart disease, stroke and some cancers? Check. A diet that strengthens bones, improves brain health and wards off dementia and depression? Check.  According to scientific research, that impossible wish list is fulfilled by a diet common to residents of 21 sun-soaked countries that surround the M",0,0,0,1,0
eng-4510078,Lawsuit filed against NJ facility over potential HIV exposure,2019-01-01,-0.1058823529411764,"news/Health, dmoz/Health/Medicine, dmoz/Health/Conditions and Diseases/Digestive Disorders, dmoz/Health/Public Health and Safety/Patient Safety",United States,Noth America,15,15,"Kemberly Richardson has the latest on a class-action lawsuit filed against a New Jersey surgery center.  More potential victims are joining a class-action lawsuit against a New Jersey surgery center that may have exposed more than 3,000 patients to HIV, hepatitis B and hepatitis C.  State health officials say patients who underwent procedures at the HealthPlus Surgery Center in Saddle Brook may have been exposed to bloodborne infections because of lapses in infection control procedures.  Attorney",0,0,0,1,0
eng-4510684,Why exercise alone won't save us,2019-01-01,0.1372549019607843,"news/Health, dmoz/Shopping/Health/Weight Loss, dmoz/Health/Weight Loss, dmoz/Health/Fitness/Advice and Guides",-,-,24,24,"Sedentary lifestyles are killing us - we need to build activity into our everyday lives, not just leave it for the gym. By Vybarr Cregan-Reid  This is the time of year when trainers are mined from under beds and gym kits are disinterred from the bottom drawer. Google searches relating to physical fitness peak in January. Many people even trawl the web to find out about ""desk exercises"" and ""workouts on the go"" in case they are too busy to use their new gym memberships.  Our relationship with exer",0,0,0,1,0
eng-4510920,"With blood supplies 'dangerously low,' donors are offered H-E-B gift cards, pizza",2019-01-01,0.05882352941176472,"news/Health, dmoz/Games/Board Games/Sports, dmoz/Science/Biology/Cryobiology",-,-,61,61,"Facing a ""dangerously low"" supply of blood to start the year, the South Texas Blood and Tissue Center is urging the public to donate blood -- and is promoting offers with H-E-B and others to help sweeten the deal.  The nonprofit organization attributed the low blood levels to declining donations over the holidays, coupled with several canceled blood drives that typically replenish supplies during the first month of the year.  Demand for blood tends to be the highest in January because many surger",0,0,0,1,1
eng-4505555,'Snowman' shape of distant Ultima revealed,2019-01-01,0.1450980392156862,"news/Science, dmoz/Science/Astronomy, dmoz/Science/Technology/Space, dmoz/Science/Astronomy/Solar System",Greenland,Noth America,637,659,"The ice world known as Ultima Thule has finally been revealed.  A new picture returned from Nasa's New Horizons spacecraft shows the little world to be two objects joined together - to give a look like a ""snowman"".  The US probe's images acquired as it approached Ultima hinted at the possibility of a double body, but the first detailed picture from Tuesday's close flyby confirms it.  New Horizons encountered Ultima 6.5 billion km from Earth.  The event set a record for the most distant ever explo",1,1,1,1,1
eng-4506353,'Super blood wolf moon' kicks off super year for eclipses,2019-01-01,0.1764705882352942,"news/Science, dmoz/Science/Astronomy/Solar System, dmoz/Science/Anomalies and Alternative Science/Anomalous Objects, dmoz/Science/Astronomy/Eclipses, Occultations and Transits",-,-,61,61,"Six eclipses will take to the sky in 2019, including one in just a few days and a total lunar eclipse that will turn the moon red later this month.  For sky watchers in parts of north Asia, the new year will begin with the moon taking a ""bite"" out of the sun a few weeks before the rest of us are treated to the spooky-sounding conjunction of celestial events known as a ""super blood wolf moon.""  Altogether there will six eclipses observable from planet Earth in 2019, including a total solar eclipse",0,1,0,0,0
eng-4506840,"ISRO Gunning For SpaceX's Falcon 9, Working On Its Own Vertical Landing Reusable Rocket",2019-01-01,0.2078431372549019,"dmoz/Science/Technology, news/Science, dmoz/Business/Aerospace and Defense/Space, dmoz/Science/Technology/Space",India,Asia,40,40,"India's usually low-profile space agency, ISRO, suddenly had the spotlight pointed at it after the success of the Mangalyaan Mars mission. And since then it has been constantly in the news - launching a record 104 satellites, testing the Crew Module on its biggest GSLV Mk3 rocket, testing the RLV (Reusable Launch Vehicle) and more recently about the Gaganyaan manned space mission.  Now, it intends to take on SpaceX. More specifically the company's Falcon 9 reusable rocket. According to a report i",0,1,0,0,0
eng-4504580,National Parks Getting Trashed During Government Shutdown,2019-01-01,-0.1450980392156863,"news/Science, dmoz/Recreation/Theme Parks, dmoz/Recreation/Theme Parks/Individual Parks, dmoz/Recreation/Theme Parks/Guides",United States,Noth America,55,74,"Filth spreads as overused restrooms and trash bins are locked, causing public health concerns.  Some National Parks are being overwhelmed by trash, vandalism, human feces and destructive off-roading while most personnel are gone during the government shutdown, according to reports from remaining workers and visitors.  ""It's so heartbreaking. There is more trash and human waste and disregard for the rules than I've seen in my four years living here,"" Dakota Snider, 24, who works in California's Yo",0,0,1,1,0
eng-4510738,Leak on International Space Station blamed on 'botched repair job',2019-01-01,-0.03529411764705881,"news/Science, dmoz/Business/Aerospace and Defense/Space, dmoz/Science/Technology/Space",-,-,10,10,"The commander of the International Space Station has confirmed that a leak in its space capsule was caused deliberately and could have had ""severe"" consequences for him and his crew.  The leak was detected by NASA officials in late August, when flight controllers on Earth noticed a dip in the air pressure of the ISS.  It was identified by the crew as coming from a two millimetre hole on a section of the Russian-made Soyuz space capsule.  Nasa said at the time the crew were ""never in any danger"", ",0,0,0,0,1
eng-4505726,"Popovich hopeful fans treat Leonard with 'kindness, respect'",2019-01-01,0.1137254901960785,"news/Sports, dmoz/Games/Video Games/Browser Based, dmoz/Games/Hand-Eye Coordination/Booby-Trap, dmoz/Sports/Basketball/Professional",United States,Noth America,235,235,"SAN ANTONIO - On the eve of Kawhi Leonard's return to San Antonio to face the Spurs as a member of the Toronto Raptors, coach Gregg Popovich said Thursday he has no regrets about how last season's drama with the player pegged to be the face of the franchise for years to come played out.  ""You move on in life,"" Popovich said. ""We're not going to re-do what's happened in the past in any way, shape or form. It's of no consequence at this point, and it does not good to go backward and talk about this",1,0,0,0,0
